<?xml version="1.0" encoding="UTF-8"?>
<?xml-stylesheet type="text/xsl" href=" WTL06.xslt" ?>
<books xmlns:xsi="http://www.w3.org/2001/XMLSchema-instance" xsi:noNamespaceSchemaLocation="WTL06.xsd">
  <book>
    <title>Movie 1</title>
    <category>Avengers</category>
    <author>10-01-2020</author>
    <publisher>Action</publisher>
    <year>2000</year>
    <isbn>35</isbn>
  </book>
  <book>
    <title>Movie 2</title>
    <category>Fast and Furious</category>
    <author>5-10-2017</author>
    <publisher>Racing</publisher>
    <year>1989</year>
    <isbn>38</isbn>
  </book>
  <book>
    <title>Movie 3</title>
    <category>Train to Busan</category>
    <author>21-08-2019</author>
    <publisher>Horror</publisher>
    <year>2020</year>
    <isbn>39</isbn>
  </book>
  <book>
    <title>Movie 4</title>
    <category>Rowdy Rathore</category>
    <author>10-04-2015</author>
    <publisher>Action</publisher>
    <year>2000</year>
    <isbn>50</isbn>
  </book>
</books>
